{
  "brief_id": "public-case-real-estate-studio-paquete-de-preventa-visual-offer-messaging",
  "company_id": "public-case-real-estate-studio",
  "offer_id": "public-case-real-estate-studio-paquete-de-preventa-visual-offer",
  "audience_label": "Directores comerciales y de mercadotecnia de desarrolladoras residenciales boutique",
  "headline": "Preventa inmobiliaria que se entiende, filtra mejor y llega mas fuerte a la visita.",
  "subheadline": "Luma Preventa Studio arma renders, video corto, recorrido 360 y landing de captacion para desarrolladoras boutique que necesitan vender antes de entregar obra, sin perder dias cada vez que cambia el proyecto.",
  "proof_points": [
    "Rondas y alcance visibles desde la propuesta",
    "Actualizacion rapida cuando cambian tipologias o amenidades",
    "Activos listos para landing, WhatsApp y sala de ventas",
    "Recorrido 360 para filtrar visitas y aumentar confianza previa"
  ],
  "objection_handlers": [
    "Aclara alcance, rondas y tiempos de actualizacion desde el inicio.",
    "Muestra como el mismo paquete sirve para pauta, WhatsApp, brokers y sala de ventas.",
    "Conecta el recorrido 360 con la meta comercial de filtrar visitas improductivas."
  ],
  "forbidden_phrases": [
    "llevar al siguiente nivel",
    "orientado a resultados",
    "partner de crecimiento",
    "servicio full-service",
    "solucion integral"
  ],
  "status": "validated",
  "confidence": 0.87,
  "source_origin": "customer_model_engine",
  "evidence_refs": [
    "2026-03-18-preventa-necesita-material-que-si-venda",
    "2026-03-18-cambios-de-proyecto-rompen-las-piezas",
    "2026-03-18-tour-360-filtra-visitas",
    "2026-03-18-confianza-remota-antes-del-showroom",
    "2026-03-18-buyer-quiere-paquete-unificado",
    "2026-03-18-objecion-sobre-alcance-y-rondas"
  ],
  "source_refs": [
    "2026-03-18-founder-sales-notes",
    "2026-03-18-tour360-recorridos",
    "2026-03-18-matterport-mx-inmobiliario",
    "2026-03-18-buyer-objections-board",
    "2026-03-18-shot360-articulo"
  ],
  "created_at": "2026-03-18T17:07:10",
  "updated_at": "2026-03-18T17:07:10"
}
